created_at,target_type,platform,title,url,intent_signal,status,reply_posted_url,tracking_link,next_action,notes
2026-07-05,forum_thread,Backpackers,"洱海、沙溪古鎮行程及大理-瀘沽湖交通請益",https://www.backpackers.com.tw/forum/showthread.php?t=10565820,"14-day Kunming-Dali-Lijiang plan; asks Erhai/Shaxi order and Dali-Lugu Lake/Lijiang transport","verified_readable_not_posted",,https://bluehourchina.com/quick/?utm_source=backpackers&utm_medium=forum_reply&utm_campaign=first_customer_week&video=erhai_shaxi_lugu,"If logged in, reply with pacing advice first; only include link if forum rules allow","Published 2024-02-05; not a fresh lead. Use as evergreen route-help reply and search visibility."
2026-07-05,forum_thread,Tripadvisor,"16 days in Yunnan from end of Jan to Feb 10 advise",https://www.tripadvisor.co.uk/ShowTopic-g294211-i642-k15451421-16_days_in_Yunnan_from_end_of_Jan_to_Feb_10_advise-China.html,"16-day Yunnan timing; likely route-planning question","search_result_needs_manual_verification",,https://bluehourchina.com/quick/en/?utm_source=tripadvisor&utm_medium=forum_reply&utm_campaign=first_customer_week&video=yunnan_16_days,"Open manually because Tripadvisor blocks automated read; reply only after confirming thread is active and self-promo rules allow","Do not count as lead until user replies or submits form."
2026-07-05,facebook_post,Facebook,"雲南自由行 group post: 六月雲南旅遊，問沙溪安排",https://www.facebook.com/groups/420563792239922/posts/1471103790519245/,"Specific Yunnan route question found in Google result; asks about Shaxi arrangement","search_result_needs_login_verification",,https://bluehourchina.com/quick/?utm_source=facebook&utm_medium=group_reply&utm_campaign=first_customer_week&video=shaxi_route,"Open while logged in; if post still allows comments, answer route question without hard sell first","Google result says more than 20 comments and about 1 year old. Use for group discovery and similar-post search."
2026-07-05,search_query,Google,"Current Chinese search: 雲南 自由行 大理 麗江 沙溪 行程",https://www.google.com/search?q=%E9%9B%B2%E5%8D%97+%E8%87%AA%E7%94%B1%E8%A1%8C+%E5%A4%A7%E7%90%86+%E9%BA%97%E6%B1%9F+%E6%B2%99%E6%BA%AA+%E8%A1%8C%E7%A8%8B,"Shows forum, Facebook and competitor route results for Dali/Shaxi/Lijiang","research_source",,https://bluehourchina.com/quick/?utm_source=google_manual&utm_medium=research_reply&utm_campaign=first_customer_week&video=cn_search,"Use this query daily; prioritize newly active forum/group posts over old evergreen posts","Not a lead; a repeatable search source."
2026-07-05,search_query,Google,"Current English search: Yunnan Dali Lijiang itinerary forum 2026",https://www.google.com/search?q=Yunnan+Dali+Lijiang+itinerary+forum+2026,"Finds English forum intent including Tripadvisor Yunnan advice posts","research_source",,https://bluehourchina.com/quick/en/?utm_source=google_manual&utm_medium=research_reply&utm_campaign=first_customer_week&video=en_search,"Use this query daily; look for active posts with month, days, group size or transport concerns","Not a lead; a repeatable search source."
